{
  "bestatt": true,
  "krav_id": "m25-feilinjisering-v1",
  "maalt": {
    "alarm_etter_andre": true,
    "alarm_etter_forste": false,
    "apne_etter": 21,
    "apne_for": 21,
    "frisk_feilet": false,
    "injeksjonsrolle_har_execute": false,
    "injisert_feilet": 2,
    "injiserte_kjoringer": 2,
    "lukkede_etter": 4,
    "lukkede_for": 4,
    "per_type_etter": {
      "betalingsplan_mangler": [
        4,
        1
      ],
      "budsjett_overskredet": [
        4,
        0
      ],
      "ingen_arbeid_registrert": [
        5,
        3
      ],
      "ingen_terskel": [
        4,
        0
      ],
      "milepael_over_frist": [
        4,
        0
      ]
    },
    "per_type_for": {
      "betalingsplan_mangler": [
        4,
        1
      ],
      "budsjett_overskredet": [
        4,
        0
      ],
      "ingen_arbeid_registrert": [
        5,
        3
      ],
      "ingen_terskel": [
        4,
        0
      ],
      "milepael_over_frist": [
        4,
        0
      ]
    },
    "registeret_urort": true,
    "tenanter": 9
  },
  "oppsett": {
    "bevisrot_sha256": "25d7d89ad3b46ad0aa67ac4ff2910a19a92502ecb398c703884c59ffde5af9e5",
    "funntabell": "prosjektfunn",
    "injeksjon": "tilkobling som disponit — uten EXECUTE på m25_sveip_prosjekter(int)",
    "injeksjonsrolle": "disponit",
    "maalerolle": "disponit_prosjekt_eier",
    "modul": "m25_prosjekt",
    "riggmodul": "m25_fasit",
    "riggtenanter": [
      "t-m25fasit-med_terskel-f6f18018",
      "t-m25fasit-uten_terskel-f6f18018"
    ],
    "runde": "f6f18018",
    "sveipedor": "m25_sveip_prosjekter(int)",
    "tenantkilde": "prosjekt",
    "vert": "cloud-server-10605510"
  },
  "ts": "2026-09-18T01:07:32.456936+00:00"
}
