{
  "bestatt": true,
  "krav_id": "m27-feilinjisering-v1",
  "maalt": {
    "alarm_etter_andre": true,
    "alarm_etter_forste": false,
    "apne_etter": 51,
    "apne_for": 51,
    "frisk_feilet": false,
    "injeksjonsrolle_har_execute": false,
    "injisert_feilet": 2,
    "injiserte_kjoringer": 2,
    "lukkede_etter": 4,
    "lukkede_for": 4,
    "per_type_etter": {
      "ikke_talt": [
        11,
        0
      ],
      "ingen_terskel": [
        11,
        0
      ],
      "under_bestillingspunkt": [
        12,
        0
      ],
      "uten_bevegelse": [
        17,
        4
      ]
    },
    "per_type_for": {
      "ikke_talt": [
        11,
        0
      ],
      "ingen_terskel": [
        11,
        0
      ],
      "under_bestillingspunkt": [
        12,
        0
      ],
      "uten_bevegelse": [
        17,
        4
      ]
    },
    "registeret_urort": true,
    "tenanter": 23
  },
  "oppsett": {
    "bevisrot_sha256": "5a4ccbf65777a72f5ef821411bc4dab265627b4201cb0bbfb16c8cd7af38cd21",
    "funntabell": "lagerfunn",
    "injeksjon": "tilkobling som disponit — uten EXECUTE på m27_sveip_lager(int)",
    "injeksjonsrolle": "disponit",
    "maalerolle": "disponit_beholdning_eier",
    "modul": "m27_lager",
    "riggmodul": "m27_fasit",
    "riggtenanter": [
      "t-m27fasit-med_terskel-a21d5189",
      "t-m27fasit-uten_terskel-a21d5189"
    ],
    "runde": "a21d5189",
    "sveipedor": "m27_sveip_lager(int)",
    "tenantkilde": [
      "vare"
    ],
    "vert": "cloud-server-10605510"
  },
  "ts": "2026-09-18T07:43:33.615034+00:00"
}
