{
  "bestatt": true,
  "krav_id": "m41-feilinjisering-v1",
  "maalt": {
    "alarm_etter_andre": true,
    "alarm_etter_forste": false,
    "apne_etter": 25,
    "apne_for": 25,
    "frisk_feilet": false,
    "injeksjonsrolle_har_execute": false,
    "injisert_feilet": 2,
    "injiserte_kjoringer": 2,
    "lukkede_etter": 1,
    "lukkede_for": 1,
    "per_type_etter": {
      "autorisasjon_utlopt": [
        5,
        0
      ],
      "belopsavvik": [
        6,
        0
      ],
      "ingen_terskel": [
        5,
        0
      ],
      "uavklart_betaling": [
        9,
        1
      ]
    },
    "per_type_for": {
      "autorisasjon_utlopt": [
        5,
        0
      ],
      "belopsavvik": [
        6,
        0
      ],
      "ingen_terskel": [
        5,
        0
      ],
      "uavklart_betaling": [
        9,
        1
      ]
    },
    "registeret_urort": true,
    "tenanter": 11
  },
  "oppsett": {
    "bevisrot_sha256": "5a4ccbf65777a72f5ef821411bc4dab265627b4201cb0bbfb16c8cd7af38cd21",
    "funntabell": "betalingsfunn",
    "injeksjon": "tilkobling som disponit — uten EXECUTE på m41_sveip_betalinger(int)",
    "injeksjonsrolle": "disponit",
    "maalerolle": "disponit_betaling_eier",
    "modul": "m41_betaling",
    "riggmodul": "m41_fasit",
    "riggtenanter": [
      "t-m41fasit-med_terskel-812dc617",
      "t-m41fasit-uten_terskel-812dc617"
    ],
    "runde": "812dc617",
    "sveipedor": "m41_sveip_betalinger(int)",
    "tenantkilde": [
      "betalingssubjekt"
    ],
    "vert": "cloud-server-10605510"
  },
  "ts": "2026-09-18T07:43:34.426651+00:00"
}
