{
  "bestatt": true,
  "krav_id": "m19-feilinjisering-v1",
  "maalt": {
    "alarm_etter_andre": true,
    "alarm_etter_forste": false,
    "apne_etter": 76,
    "apne_for": 76,
    "frisk_feilet": false,
    "injeksjonsrolle_har_execute": false,
    "injisert_feilet": 2,
    "injiserte_kjoringer": 2,
    "lukkede_etter": 3,
    "lukkede_for": 3,
    "per_type_etter": {
      "avvist_adresse": [
        13,
        1
      ],
      "ingen_krav": [
        13,
        0
      ],
      "kontroll_utlopt": [
        13,
        0
      ],
      "ukontrollert_adresse": [
        24,
        2
      ],
      "utilstrekkelig_metode": [
        13,
        0
      ]
    },
    "per_type_for": {
      "avvist_adresse": [
        13,
        1
      ],
      "ingen_krav": [
        13,
        0
      ],
      "kontroll_utlopt": [
        13,
        0
      ],
      "ukontrollert_adresse": [
        24,
        2
      ],
      "utilstrekkelig_metode": [
        13,
        0
      ]
    },
    "registeret_urort": true,
    "tenanter": 27
  },
  "oppsett": {
    "bevisrot_sha256": "5a4ccbf65777a72f5ef821411bc4dab265627b4201cb0bbfb16c8cd7af38cd21",
    "funntabell": "adressefunn",
    "injeksjon": "tilkobling som disponit — uten EXECUTE på m19_sveip_adresser(int)",
    "injeksjonsrolle": "disponit",
    "maalerolle": "disponit_adresse_eier",
    "modul": "m19_adresse",
    "riggmodul": "m19_fasit",
    "riggtenanter": [
      "t-m19fasit-med_krav-d4223baa",
      "t-m19fasit-uten_krav-d4223baa"
    ],
    "runde": "d4223baa",
    "sveipedor": "m19_sveip_adresser(int)",
    "tenantkilde": [
      "adressesubjekt"
    ],
    "vert": "cloud-server-10605510"
  },
  "ts": "2026-09-18T07:43:32.305637+00:00"
}
